{
  "meta": {
    "schema_version": "0.4.1",
    "esaa_version": "0.4.1",
    "immutable_done": true,
    "master_correlation_id": null,
    "run": {
      "run_id": null,
      "status": "initialized",
      "last_event_seq": 0,
      "projection_hash_sha256": "0000000000000000000000000000000000000000000000000000000000000000",
      "verify_status": "unknown"
    },
    "updated_at": "{{updated_at}}"
  },
  "project": {
    "name": "Integração all-in-one de {{system_name}} ao Hub Sistemas CPS (SSO)",
    "audit_scope": "Cliente={{system_slug}} | SSO all-in-one | OAuth 2.0 authorization_code; JWT RS256/ES256; JWKS; SQL de configuração; LGPD; comentários e documentação gerados em português do Brasil | stack_target=agnostic"
  },
  "tasks": [
    {
      "task_id": "T-001",
      "task_kind": "spec",
      "title": "[SPEC] G0 — Discovery all-in-one do sistema alvo",
      "description": "Especificar a descoberta obrigatória antes de gerar o SSO all-in-one. A descoberta da stack é a primeira tarefa e DEVE detectar linguagem, framework, roteador, mecanismo de build/autoload, sessão local, login legado, tabela/campo de CPF, banco de dados, base path e caminho real para artefatos. Antes de marcar manual_input_required, G0 DEVE ler .roadmap/sso-client-input.local.json quando existir, usando-o apenas para complementar dados do cliente SSO como system_name, system_slug, client_base_url, client_base_path, sso_callback_path, post_login_redirect, post_logout_redirect, sso_client_id, sso_client_secret e flow_modes. Esse arquivo nao substitui discovery de stack/caminhos; conflito entre language_profile informado e stack detectada exige decisao manual. O runtime-contract.json DEVE conter language_profile, config_table e sso_file_plan com as chaves sso_file_plan.all_in_one_client, sso_file_plan.config_sql, sso_file_plan.controller, sso_file_plan.routes, sso_file_plan.tests e sso_file_plan.docs. Perfis válidos: php gera SsoClientAllInOne.php; python gera sso_client_all_in_one.py; go gera sso_client_all_in_one.go; csharp gera SsoClientAllInOne.cs; genexus gera artefato/procedure HTTP com o mesmo contrato lógico. Todos os comentários, docblocks, comentários SQL, textos de apoio e documentação gerados DEVEM estar em pt-BR, usando português do Brasil.",
      "status": "todo",
      "depends_on": [],
      "targets": [
        "AIO-001",
        "AIO-002",
        "AIO-003",
        "AIO-004"
      ],
      "outputs": {
        "files": [
          "docs/spec/G00-discovery-all-in-one.md",
          ".roadmap/templates/sso-client-input.local.example.json",
          "docs/sso-clients/project-structure.json",
          "docs/sso-clients/runtime-contract.json",
          "docs/sso-clients/runtime-contract.schema.json"
        ]
      },
      "immutability": {
        "done_is_immutable": true
      },
      "required_verification": [
        "runtime-contract.json contem language_profile, config_table e sso_file_plan",
        "sso_file_plan contem all_in_one_client, config_sql, controller, routes, tests e docs",
        "nenhum campo P0 e omitido silenciosamente; quando nao detectado no codigo, consulta .roadmap/sso-client-input.local.json e depois usa manual_input_required=true",
        "Contrato SsoAllIn-portugues-estruturado.md §11 (discovery e entrada local) e §2 (AIO-001..004): runtime-contract.json com language_profile, config_table e sso_file_plan"
      ]
    },
    {
      "task_id": "T-002",
      "task_kind": "impl",
      "title": "[IMPL] G0 — Coletor runtime para artefatos all-in-one",
      "description": "Implementar ou ajustar o coletor para produzir docs/sso-clients/runtime-contract.json com language_profile, config_table e sso_file_plan all-in-one. O coletor deve derivar runtime://sso_file_plan.all_in_one_client, runtime://sso_file_plan.config_sql, runtime://sso_file_plan.controller, runtime://sso_file_plan.routes, runtime://sso_file_plan.tests e runtime://sso_file_plan.docs a partir dos caminhos reais do sistema, nunca de destinos genericos. Se existir .roadmap/sso-client-input.local.json, o coletor deve usar seus campos para preencher dados SSO nao inferíveis e registrar em evidence/local_input que o arquivo foi usado, sem gravar segredo real em relatórios. Para PHP/Olivia, exemplos esperados sao app/Sso/SsoClientAllInOne.php, database/sso-config.sql ou docs/sso-clients/sql/sso-config.sql, app/Controller/SsoController.php, lib/Route.php e tests/sso-runtime/.",
      "status": "todo",
      "depends_on": [
        "T-001"
      ],
      "targets": [
        "AIO-001",
        "AIO-002",
        "AIO-003",
        "AIO-004"
      ],
      "outputs": {
        "files": [
          "docs/sso-clients/runtime-contract.json",
          "docs/sso-clients/project-structure.json"
        ]
      },
      "immutability": {
        "done_is_immutable": true
      },
      "required_verification": [
        "language_profile e config_table sao preenchidos",
        "todos os runtime://sso_file_plan.* all-in-one resolvem para destinos concretos ou manual_input_required",
        "quando .roadmap/sso-client-input.local.json existir, seus dados sao usados sem vazar sso_client_secret",
        "Contrato SsoAllIn-portugues-estruturado.md §11: runtime://sso_file_plan.* resolvem para caminhos reais e entrada local complementa dados SSO (AIO-002, AIO-003)"
      ]
    },
    {
      "task_id": "T-003",
      "task_kind": "qa",
      "title": "[QA] G0 — Discovery all-in-one completo",
      "description": "Testar que a descoberta identifica linguagem, banco, login local, sessao e paths reais. Validar que o runtime-contract.json possui language_profile, config_table e todas as chaves sso_file_plan.* all-in-one. Testar tambem o uso de .roadmap/sso-client-input.local.json para preencher dados SSO nao inferíveis, sem vazar sso_client_secret em relatórios. Confirmar que comentarios e documentacao gerados pelo G0 estao em portugues do Brasil.",
      "status": "todo",
      "depends_on": [
        "T-002"
      ],
      "targets": [
        "AIO-001",
        "AIO-002",
        "AIO-003",
        "AIO-004"
      ],
      "outputs": {
        "files": [
          "tests/sso-clients/all-in-one-discovery/",
          "docs/qa/G00-all-in-one-discovery.md"
        ]
      },
      "immutability": {
        "done_is_immutable": true
      },
      "required_verification": [
        "Contrato SsoAllIn-portugues-estruturado.md §11 e §1 (escopo); QA confirma pt-BR, entrada local e manual_input_required (AIO-004)"
      ]
    },
    {
      "task_id": "T-004",
      "task_kind": "spec",
      "title": "[SPEC] G1 — Contrato do cliente SSO All-In-One",
      "description": "Especificar o contrato publico unico do cliente all-in-one para todas as linguagens usando docs/spec/SsoAllIn-portugues-estruturado.md como arquivo auxiliar normativo em português estruturado. A interface deve conter equivalentes de health, startLogin, handleCallback, logout, getCurrentUser e loginLocal(cpf), preservando a responsabilidade descrita para cada método no arquivo auxiliar. O metodo loginLocal(cpf) deve ficar vazio ou sobrescritivel e deve ser chamado por ultimo, depois de state, token exchange, validacao JWT/JWKS, anti-replay jti e extracao do CPF confiavel. Segredos e configuracoes devem vir do banco via config_table primeiro, depois ambiente, depois valor padrao. Comentarios e docblocks do artefato gerado devem estar em pt-BR.",
      "status": "todo",
      "depends_on": [
        "T-003"
      ],
      "targets": [
        "AIO-010",
        "AIO-011",
        "AIO-012",
        "AIO-013"
      ],
      "outputs": {
        "files": [
          "docs/spec/SsoAllIn-portugues-estruturado.md",
          "docs/spec/G01-contrato-all-in-one.md",
          "runtime://sso_file_plan.docs"
        ]
      },
      "immutability": {
        "done_is_immutable": true
      },
      "required_verification": [
        "Contrato SsoAllIn-portugues-estruturado.md §2 (AIO-010..013), §6 (loginLocal finalizador) e §9 (API pública): health/startLogin/handleCallback/logout/getCurrentUser/loginLocal(cpf)"
      ]
    },
    {
      "task_id": "T-005",
      "task_kind": "impl",
      "title": "[IMPL] G1 — Adaptador de contrato all-in-one",
      "description": "Materializar o contrato no destino runtime://sso_file_plan.all_in_one_client como esqueleto compilavel na linguagem detectada. O artefato deve expor health, startLogin, handleCallback, logout, getCurrentUser e loginLocal(cpf), com comentarios em portugues do Brasil. Ainda nao implementar detalhes criptograficos completos nesta tarefa; garantir a forma publica, a leitura de configuracao e o ponto de customizacao local.",
      "status": "todo",
      "depends_on": [
        "T-004"
      ],
      "targets": [
        "AIO-010",
        "AIO-011",
        "AIO-012",
        "AIO-013"
      ],
      "outputs": {
        "files": [
          "runtime://sso_file_plan.all_in_one_client"
        ]
      },
      "immutability": {
        "done_is_immutable": true
      },
      "required_verification": [
        "Contrato SsoAllIn-portugues-estruturado.md §9 (forma pública) e §4 (config banco->ambiente->padrão); esqueleto compila (AIO-010, AIO-012, AIO-013)"
      ]
    },
    {
      "task_id": "T-006",
      "task_kind": "qa",
      "title": "[QA] G1 — Contrato all-in-one verificavel",
      "description": "Testar que o cliente all-in-one compila ou passa no linter da linguagem detectada e que a API publica contem health, startLogin, handleCallback, logout, getCurrentUser e loginLocal(cpf). Testar que loginLocal(cpf) existe, recebe apenas CPF e nao exige outro parametro. Verificar que comentarios/docblocks do artefato estao em portugues do Brasil e nao contem trechos comuns em ingles.",
      "status": "todo",
      "depends_on": [
        "T-005"
      ],
      "targets": [
        "AIO-010",
        "AIO-011",
        "AIO-012",
        "AIO-013"
      ],
      "outputs": {
        "files": [